Content,Type
quick easi recip oven-roast asparagu perfect spring side dish basic recip season mani differ ways—add lemon juic garlic shave parmesan variat roast asparagu super easi side dish goe well almost anyth like chicken steak salmon bake ham pork ’ great quick weeknight dinner holiday side dish live divid hous come asparagu half us love half… much still make roast asparagu toss leftov salad egg heat lunch roast asparagu delici simpl way prepar nutriti veget ’ basic recip get start make basic recip need bunch asparagu oliv oil oliv oil spray kosher salt fresh black pepper see full recip recip card roast asparagu versatil pair well varieti dish make perfect side weeknight dinner special occas simpl method give tender-crisp asparagu roast asparagu recip versatil would great protein starchi side dish list idea store asparagu refriger 4 day reheat microwav 1 2 minut find roast asparagu 400f oven 10 15 minut depend thick give perfect asparagu everi time roast asparagu 350f take 12 18 minut depend thick ’ noth wrong cut woodi end also easili snap instead asparagu inde superfood make must-hav diet aim nutrit complet diseas prevent veget delici also offer signific health benefit everi serv ’ pack fiber digest health folat dna synthesi vitamin c e immun support skin health vision ’ rich antioxid amino acid asparagin promot healthi heart reduc diseas risk post pic mention skinnytast tag skinnytast subscrib weekli email newslett free 'll get latest meal idea new recip everi week pleas check follow indic would like receiv email skinnytast use mailchimp market platform click subscrib acknowledg inform transfer mailchimp process learn mailchimp 's privaci practic unsubscrib time click link footer email stay date wherev,Food
ton flavor quick anti-inflammatori turmer garlic shrimp dish perfect balanc flavor – readi 30 minut lot ask anti-inflammatori recip mani site go label thought would start one healthi turmer garlic shrimp made color raw cabbag mango salad lime dress ’ color vibrant load anti-inflammatori ingredi like oliv oil turmer mango red cabbag mani ingredi list anti-inflammatori properti offer variou health benefit season shrimp turmer cumin red pepper flake gave quick saut garlic finish fresh lime juic cilantro balanc heat ’ mild although make spicier leav milder tast serv quick slaw sweet mango red cabbag lime juic husband gave two thumb post pic mention skinnytast tag skinnytast subscrib weekli email newslett free 'll get latest meal idea new recip everi week pleas check follow indic would like receiv email skinnytast use mailchimp market platform click subscrib acknowledg inform transfer mailchimp process learn mailchimp 's privaci practic unsubscrib time click link footer email stay date wherev,Food
grill salmon bruschetta avocado go-to summer recip ’ easi fresh flavor must tri grill salmon easi make foolproof method ’ grill outdoor summer long top fresh tomato avocado “ bruschetta ” dish scream summer ad avocado classic tomato salad pretti geniu ’ like salmon salad would also good grill chicken even toast salmon recip love blacken grill salmon skewer air fryer salmon recip went fire island last week closest high school friend kid sit beach talk friend kim recip idea ye food alway mind mention salmon dish serv restaur work love everyth next day pick salmon whip turn good know ’ agre avocado bruschetta make foolproof salmon grill use salmon skin lay salmon skin side directli grill cover grill let cook like would oven turn depend thick take 10 minut remov grill discard char skin ’ ok skin stick grill point fish ’ break protect meat hope enjoy grill salmon recip ’ like salmon serv grill swordfish even grill chicken prefer would go great orzo couscou crusti bread big green salad post pic mention skinnytast tag skinnytast subscrib weekli email newslett free 'll get latest meal idea new recip everi week pleas check follow indic would like receiv email skinnytast use mailchimp market platform click subscrib acknowledg inform transfer mailchimp process learn mailchimp 's privaci practic unsubscrib time click link footer email stay date wherev,Food
look best way use chickpea falafel hummu salad sheet pan dinner 15 easi chickpea recip make dinner plan breez chickpea aka garbanzo bean one favorit plant-bas protein sourc ’ alway find two cupboard ’ cheap requir minim prep great sourc protein think us think “ hummu ” “ falafel ” think chickpea recip – dish amaz – mani option chickpea small mighti ingredi one elev dish nay yay ’ use can chickpea ’ hardli prep liter drain rins add salad dish one reason chickpea versatil ingredi mild flavor – much lighter bean slightli earthi tast gener flavor come whatev season ingredi cook without ago favorit garbanzo bean recip everi occas subscrib weekli email newslett free 'll get latest meal idea new recip everi week pleas check follow indic would like receiv email skinnytast use mailchimp market platform click subscrib acknowledg inform transfer mailchimp process learn mailchimp 's privaci practic unsubscrib time click link footer email stay date wherev,Food
’ love faster lighter chicken marbella chicken thigh cook stove-top prune spanish oliv caper garlic oregano flavor easi mediterranean-styl dish love find new way cook chicken thigh mediterranean style dinner sure becom regular recip rotat combin sweet prune salti tang caper oliv make chicken marbella delici dish balanc tast contrast flavor beauti chicken thigh recip might want check brais chicken thigh mushroom leek bake chicken thigh air fryer asian-glaz chicken thigh hi ’ heather k. jones—i ’ dietitian nutrit expert skinnytast cookbook founder weight well program feel better eat better struggl nighttim over emot food crave sure check power potent tool call 5-minut crave cure easy-to-us guid audio ’ discov 5-minut solut stop over start also free emot eat group coach session time month insid love healthi facebook group pleas join could use support inspir chicken marbella one favorit recip classic silver palat cookbook make dish idea much like prune ha also idea perfectli prune pair oliv capers… ’ sweet salti combo work origin chicken marbella recip made 1 cup brown sugar yike whole head garlic pure time consum 1 cup wine ’ even sugar … plu chicken need marin overnight decid tri make dish much lighter also much faster first cut back sugar 1 tablespoon instead skin chicken piec use remov skin chicken thigh piec also swap entir pure head garlic 6 chop clove use low-sodium chicken broth place white wine also instead use marinad chicken cook everyth stove-top creat delici pan-sauc pan juic end honestli like lighter faster version even better origin ’ ’ need see full ingredi measur bottom post recip card serv dish couscou big green salad husband alway get excit marbella menu would also go great crusti bread rice rice pilaf roast potato even cauliflow rice keep light let know comment love dish prune much,Food
one-pot chicken orzo recip crispi chicken thigh cook right top orzo garlicki tomato sauc basil ’ simpl make serv straight oven favorit side salad love one-pan dinner much cookbook skinnytast one done featur 120 one-pot dinner recip ’ fan favorit one pot chicken orzo bake ’ disappoint skin crispi delici orzo sauc flavor serv simpl arugula salad side roast veget like broccoli roast asparagu would also great ’ ’ need make easi one-pot chicken orzo recip veget side dish would great healthi chicken orzo recip leftov chicken orzo pasta keep refriger 4 day airtight contain also freez 3 month eat thaw fridg microwav warm post pic mention skinnytast tag skinnytast subscrib weekli email newslett free 'll get latest meal idea new recip everi week pleas check follow indic would like receiv email skinnytast use mailchimp market platform click subscrib acknowledg inform transfer mailchimp process learn mailchimp 's privaci practic unsubscrib time click link footer email stay date wherev,Food
babi arugula salad go-to need quick side salad recip fish steak chicken pork chop healthi arugula salad shave parmesan requir chop take minut whip good make time ’ believ never post ’ perfect side dish mani meal doubl portion add grill shrimp salmon chicken make main dish arugula salad recip tri arugula salmon salad caper shave parmesan peach arugula salad easi pepperi arugula salad recip take minut make love whip side salad need someth green round meal pair well dish great ’ much extra time side dish serv suggest green salad best eaten day made leftov get soggi make amount salad eat one night store ingredi separ arugula babi arugula babi arugula pick earlier tast milder less pepperi leav smaller arugula strong pepperi tast pair great lemon babi arugula milder pepper tast ’ need cut arugula sinc ’ alreadi bite-s cut though prefer smaller piec post pic mention skinnytast tag skinnytast subscrib weekli email newslett free 'll get latest meal idea new recip everi week pleas check follow indic would like receiv email skinnytast use mailchimp market platform click subscrib acknowledg inform transfer mailchimp process learn mailchimp 's privaci practic unsubscrib time click link footer email stay date wherev,Food
chicken saltimbocca made pound chicken breast stuf prosciutto sage light white wine sauc chicken saltimbocca variat tradit italian dish saltimbocca typic featur veal cutlet wrap prosciutto sage order dish time favorit italian restaur load butter butter make everyth tast soo good lighter adapt chicken breast use instead veal maintain essenc dish provid lighter poultri altern saltimbocca name italian dish translat “ jump mouth ” tradit made veal cutlet wrap prosciutto sage quickli cook butter oil occasion top melt chees chicken saltimbocca pair well variou side dish complement flavor textur option post pic mention skinnytast tag skinnytast subscrib weekli email newslett free 'll get latest meal idea new recip everi week pleas check follow indic would like receiv email skinnytast use mailchimp market platform click subscrib acknowledg inform transfer mailchimp process learn mailchimp 's privaci practic unsubscrib time click link footer email stay date wherev,Food
garlicki italian shrimp salad recip load shrimp celeri mix bold italian oliv brighten lemoni dress shrimp salad go-to dish need bring appet parti ’ great way make sure ’ get lean protein healthi option eat healthi control recent brought italian shrimp salad parti everyon love ’ refresh high-protein perfect warmer month flavor oliv celeri garlic get better marin fridg best part everyth ’ cook combin ingredi marin ’ also great meal prep cold lunch anoth favorit make time zesti lime shrimp salad avocado creami shrimp salad italian shrimp pasta salad variat find complet recip measur easi italian shrimp salad take minut make love italian seafood salad quick weeknight dinner easi dish serv parti suggest serv keep italian shrimp salad fridg 3 day flavor get better sit post pic mention skinnytast tag skinnytast subscrib weekli email newslett free 'll get latest meal idea new recip everi week pleas check follow indic would like receiv email skinnytast use mailchimp market platform click subscrib acknowledg inform transfer mailchimp process learn mailchimp 's privaci practic unsubscrib time click link footer email stay date wherev,Food
love cream asparagu soup ’ pure comfort bowl simpl make recip made 5 ingredi count salt pepper readi 25 minut light healthi cream asparagu soup made cream ’ simpli pure littl sour cream total omit want keep dairi free water littl sour cream drizzl littl top 100 calori perfect first cours serv sandwich salad see soup recip asparagu soup made 7 ingredi see exact measur recip card cream soup ’ load heavi cream sever way make creami soup first get immers blender ’ alreadi one probabl time favorit kitchen gadget ’ much easier put hot soup blender sever batch trust post pic mention skinnytast tag skinnytast subscrib weekli email newslett free 'll get latest meal idea new recip everi week pleas check follow indic would like receiv email skinnytast use mailchimp market platform click subscrib acknowledg inform transfer mailchimp process learn mailchimp 's privaci practic unsubscrib time click link footer email stay date wherev,Food
best ground turkey taco scratch healthi quick easi taco dinner whole famili love best turkey taco recip ’ go-to taco night tradit taco typic use beef pork ground turkey taco much leaner altern without sacrif flavor ’ delici versatil use homemad taco season easi adjust like ad artifici ingredi serv corn flour tortilla taco check origin low-carb turkey taco lettuc wrap recip help make best ground turkey taco home taco tuesday cinco de mayo night week ’ ’ need turkey taco recip see exact measur recip card foolproof method make best tast turkey taco side dish idea pair healthi ground turkey taco complet meal usual doubl turkey recip use rest anoth recip like meximelt ground turkey taco healthier beef taco depend fat content use 93 ground turkey mean ’ 93 lean 7 fat still flavor ’ dri lower calori varieti like 85 use lean 93 beef nutrit inform similar 93 turkey like protein ground turkey must well season tast good gener season meat homemad taco season add aromat like garlic onion bell pepper ground turkey simmer tomato sauc water prevent dri infus flavor turkey taco meat perfect meal prep sinc freez well doubl recip freez half thaw refriger overnight quick dinner ’ time cook best result eat within 3 month post pic mention skinnytast tag skinnytast subscrib weekli email newslett free 'll get latest meal idea new recip everi week pleas check follow indic would like receiv email skinnytast use mailchimp market platform click subscrib acknowledg inform transfer mailchimp process learn mailchimp 's privaci practic unsubscrib time click link footer email stay date wherev,Food
free 7-day flexibl weight loss meal plan includ breakfast lunch dinner idea shop list recip includ macro weight watcher point spring continu bloom rain school sport extra curricular activ kick high gear basebal softbal soccer band danc name slow cooker recip make easi dinner readi get home long day quick meal allow get meal tabl tight schedul win win ’ new meal plan ’ share free 7-day flexibl healthi meal plan see previou meal plan meant guid plenti wiggl room add food coffe beverag fruit snack dessert wine etc swap recip meal prefer search recip cours index depend goal aim least 1500 calori per day ’ one size fit rang goal age weight etc ’ also precis organ groceri list make groceri shop much easier much less stress save money time ’ dine less often wast less food ’ everyth need hand help keep track lastli ’ facebook join skinnytast facebook commun everyon ’ share photo recip make join ’ love idea everyon ’ share wish get email list subscrib never miss meal plan check 5 favorit deal sale happen weekend get skinnytast ultim meal planner 52 week spiral bound meal planner weekli meal plan grid tear put fridg wish 12-week meal plan 30 15 new recip tear-out groceri list love start week gratitud affirm intent includ space well hope love much ’ follow weight watcher recip updat reflect new weight watcher program point display recip titl ww button recip card take weight watcher websit see recip builder use determin point add day us must log account cookbook recip cookbook index also updat,Food
high protein waffl made cottag chees oat flour egg good ’ never make way ’ obsess healthi oat waffl ’ eat practic everi morn breakfast four waffl 17 gram protein may want doubl recip skinnytast simpl cookbook also find recip protein top mine nut butter plu banana strawberri top anyth wish ’ tast cottag chees good good freez pop toaster want waffl recip use regular flour yogurt see recip yogurt waffl recip cottag chees tri savori cottag chees bowl cottag chees egg frittata high protein bread recip waffl simpl made 7 ingredi see exact measur recip card got small dash waffl maker christma 12 cute come mani color pattern use make waffl although larger one find use one waffl maker bigger adjust batter need ’ find oat flour store make place oat blender process resembl fine flour meal prep batter last refriger 3 4 day want make ahead also make waffl refriger pop toaster ton high protein breakfast idea ’ post pic mention skinnytast tag skinnytast subscrib weekli email newslett free 'll get latest meal idea new recip everi week pleas check follow indic would like receiv email skinnytast use mailchimp market platform click subscrib acknowledg inform transfer mailchimp process learn mailchimp 's privaci practic unsubscrib time click link footer email stay date wherev,Food
need takeout easi pad thai recip readi 25 minut lighten version signatur sweet-and-tangi flavor along rice noodl bean sprout tender shrimp scrambl egg custom favorit protein love thai food ’ surpris ’ big fan pad thai thai stir-fri rice noodl thai cuisin prize perfect balanc four main tast hot sour salti sweet pad thai except flavor repres dish like thai basil chicken bang bang chicken salad ’ one recip ’ sum part simpl ingredi come togeth creat delici dish ’ done 30 minut ’ weeknight win everyth make pad thai easi includ ingredi list scroll recip card exact measur fish sauc one key element pad thai sauc without ’ delici noodl dish ’ authent flavor ’ okay substitut soy sauc coconut amino tamari anoth option vegan fish sauc fish sauc flavor without actual fish make suitabl anyon allergi ’ quick overview step involv make pad thai see recip card detail instruct takeout-at-hom dinner pair pad thai recip shrimp egg roll asian cabbag mango slaw asian-inspir favorit post pic mention skinnytast tag skinnytast subscrib weekli email newslett free 'll get latest meal idea new recip everi week pleas check follow indic would like receiv email skinnytast use mailchimp market platform click subscrib acknowledg inform transfer mailchimp process learn mailchimp 's privaci practic unsubscrib time click link footer email stay date wherev,Food
one-pot creami chicken pasta primavera made lean chicken breast spring veggi light cream sauc delici high-protein dinner idea primavera mean “ spring ” italian thought name high-protein pasta dish fit sinc ’ made spring asparagu leek artichok pea creami sauc made cream chees parmesan chees blend littl milk portion gener amount veggi chicken 30 gram protein per serv ’ delici hope enjoy primavera recip tri risotto primavera spaghetti squash primavera healthi chicken pasta primavera complet meal load veggi protein ’ serv big group want stretch serv peopl pair green salad crusti bread store leftov pasta primavera 4 day fridg 3 month freezer thaw pasta refriger microwav warm post pic mention skinnytast tag skinnytast subscrib weekli email newslett free 'll get latest meal idea new recip everi week pleas check follow indic would like receiv email skinnytast use mailchimp market platform click subscrib acknowledg inform transfer mailchimp process learn mailchimp 's privaci practic unsubscrib time click link footer email stay date wherev,Food
